{"doc_id":"doc_01K6ESYD1QR21NK4AHWRMSJE4J","filename":"Epf-Co.pdf","doc_label":null,"project_id":null,"size_bytes":47991,"sha256":"3fc4bc96df188d6e7412e56eb8a4e3b1c4196eab5a30850952ec9a52f83b14e5","status":"completed","job_id":"job_01K6ESYDC0YJYXRRJWANSD1EYZ","uploaded_at":"2025-10-01T02:34:40.568065+00:00","updated_at":"2025-10-01T02:34:40.900106+00:00","artifacts":{"base_dir":"/workspace/FluidRAG/rag-app/storage/parser/doc_01K6ESYD1QR21NK4AHWRMSJE4J","detected_headers":"/workspace/FluidRAG/rag-app/storage/parser/doc_01K6ESYD1QR21NK4AHWRMSJE4J/detected_headers.json","gaps":"/workspace/FluidRAG/rag-app/storage/parser/doc_01K6ESYD1QR21NK4AHWRMSJE4J/gaps.json","audit_html":"/workspace/FluidRAG/rag-app/storage/parser/doc_01K6ESYD1QR21NK4AHWRMSJE4J/audit.html","audit_md":"/workspace/FluidRAG/rag-app/storage/parser/doc_01K6ESYD1QR21NK4AHWRMSJE4J/audit.md","results_junit":"/workspace/FluidRAG/rag-app/storage/parser/doc_01K6ESYD1QR21NK4AHWRMSJE4J/results.junit.xml","tuned_config":"/workspace/FluidRAG/rag-app/storage/parser/doc_01K6ESYD1QR21NK4AHWRMSJE4J/tuned.header_detector.toml"},"error":null}